{
  "metadata": {
    "framework": "MKM Research Labs Model Risk Governance",
    "version": "1.0.0",
    "last_updated": "2026-06-17",
    "handbook_reference": "Handbook of Model Risk Management for Vendors (Kelly, Mattimore 2025)",
    "tiering_methodology": "Materiality x Complexity matrix (Chapter 8: Proportionality)"
  },
  "models": [
    {
      "model_id": "MKM-SI-001",
      "name": "Storm Intensity Distribution",
      "short_name": "Storm Intensity",
      "description": "Hybrid Normal-Pareto distribution for storm rainfall intensity modelling. Uses Gaussian core with Generalised Pareto Distribution (GPD) tail above a fitted threshold.",
      "category": "Hazard",
      "tier": 2,
      "materiality": "Medium",
      "complexity": "Medium",
      "tier_rationale": "Medium materiality: feeds into downstream hazard models but not directly into pricing. Medium complexity: hybrid distribution with threshold selection requiring expert judgement.",
      "status": "Active",
      "lifecycle_stage": "Development",
      "version": "1.0.0",
      "owner": "David K Kelly",
      "model_owner_role": "Chief Science Officer",
      "peer_reviewer": "TBD",
      "source_module": "src/models/intensity/distribution.py",
      "methodology": "Hybrid Normal-GPD with maximum likelihood threshold estimation",
      "alternatives_considered": [
        "Pure Pareto",
        "Lognormal",
        "GPD only",
        "Pure GEV"
      ],
      "methodology_rationale": "Hybrid approach captures both typical and extreme rainfall. Pure Pareto overestimates body; lognormal underestimates tail. GPD-only misses the distribution body needed for moderate events.",
      "assumptions": [
        {
          "id": "SI-A1",
          "description": "Storm events are independent",
          "impact": "Medium",
          "monitoring": "Check autocorrelation in residuals",
          "mitigation": "Seasonal decomposition if violated"
        },
        {
          "id": "SI-A2",
          "description": "Stationarity of rainfall distribution",
          "impact": "High",
          "monitoring": "Rolling parameter stability test",
          "mitigation": "Climate trend adjustment"
        },
        {
          "id": "SI-A3",
          "description": "No spatial correlation between storm intensities",
          "impact": "Medium",
          "monitoring": "Cross-site correlation analysis",
          "mitigation": "Copula extension if needed"
        },
        {
          "id": "SI-A4",
          "description": "GPD threshold selection is appropriate",
          "impact": "High",
          "monitoring": "Mean residual life plot stability",
          "mitigation": "Sensitivity analysis on threshold"
        }
      ],
      "limitations": [
        {
          "id": "SI-L1",
          "description": "Independence assumption may not hold for clustered storm events",
          "impact": "Medium",
          "monitoring_trigger": "Autocorrelation > 0.3 at lag 1",
          "compensating_control": "Manual review of clustered events"
        },
        {
          "id": "SI-L2",
          "description": "Stationarity assumption ignores climate change trends",
          "impact": "High",
          "monitoring_trigger": "Significant trend in 10-year rolling parameters",
          "compensating_control": "Annual recalibration with trend test"
        },
        {
          "id": "SI-L3",
          "description": "No spatial correlation modelled",
          "impact": "Medium",
          "monitoring_trigger": "Portfolio concentration in single catchment",
          "compensating_control": "Diversification requirement"
        },
        {
          "id": "SI-L4",
          "description": "Threshold selection involves subjective judgement",
          "impact": "Medium",
          "monitoring_trigger": "Threshold sensitivity > 10% on tail quantiles",
          "compensating_control": "Document threshold selection rationale"
        }
      ],
      "known_failure_modes": [
        "Very small sample sizes (<20 events) cause unstable GPD fit",
        "Bimodal rainfall distributions (convective + frontal) poorly captured by single hybrid",
        "Extreme extrapolation beyond observed data unreliable"
      ],
      "key_parameters": [
        "threshold",
        "gpd_shape (xi)",
        "gpd_scale (sigma)",
        "normal_mean",
        "normal_std"
      ],
      "input_data": "Historical rainfall observations (Environment Agency gauge network)",
      "output_data": "Storm intensity probability distribution, exceedance probabilities",
      "downstream_models": [
        "MKM-SG-001"
      ],
      "upstream_models": [],
      "validation_status": "Initial",
      "validation_date": null,
      "next_review_date": "2026-06-15",
      "recertification_date": "2027-02-15",
      "review_frequency": "Semi-annual",
      "documents": [
        {
          "type": "Model Documentation",
          "name": "Storm Intensity Distribution Documentation",
          "path": "docs/models/storm_intensity/storm_intensity.pdf"
        }
      ],
      "change_history": [
        {
          "version": "1.0.0",
          "date": "2025-12-01",
          "author": "David K Kelly",
          "type": "Initial",
          "description": "Initial implementation of hybrid Normal-Pareto storm intensity model"
        }
      ],
      "test_coverage": {
        "unit_tests": true,
        "integration_tests": true,
        "benchmark_tests": false,
        "test_file": "tests/models/test_intensity_distribution.py"
      },
      "last_review_date": "2026-02-13",
      "rag_rating": "Green",
      "mrc_signoff_date": "2026-02-06",
      "remediation_steps": [
        {
          "id": "SI-R1",
          "description": "Complete benchmark tests against EA published intensity distributions",
          "owner": "David K Kelly",
          "priority": "Medium",
          "due_date": "2026-04-15",
          "status": "Open"
        },
        {
          "id": "SI-R2",
          "description": "Assign independent peer reviewer for threshold selection methodology",
          "owner": "David K Kelly",
          "priority": "High",
          "due_date": "2026-03-31",
          "status": "Open"
        }
      ],
      "version_history": [
        {
          "version": "0.1.0",
          "date": "2025-09-15",
          "author": "David K Kelly",
          "description": "Initial prototype of storm intensity distribution using pure Pareto",
          "document": "PhysicalRisk_Platform_Guide_v1.pdf"
        },
        {
          "version": "0.2.0",
          "date": "2025-10-20",
          "author": "David K Kelly",
          "description": "Switched to hybrid Normal-GPD approach for better body fit",
          "document": "PhysicalRisk_Platform_Guide_v1.pdf"
        },
        {
          "version": "1.0.0",
          "date": "2025-12-01",
          "author": "David K Kelly",
          "description": "Production-candidate release with MLE threshold estimation",
          "document": "PhysicalRisk_Validation_v1.pdf"
        }
      ],
      "validation_questions": [
        {
          "question_id": 1,
          "short_label": "Ronseal Test",
          "question": "Does the model do what it says on the tin?",
          "handbook_ref": "Chapter 5, Question 1",
          "status": "Not Addressed",
          "evidence": "",
          "last_reviewed": null,
          "reviewed_by": null
        },
        {
          "question_id": 2,
          "short_label": "Accuracy & Stability",
          "question": "Does the model provide timely, accurate and stable results?",
          "handbook_ref": "Chapter 5, Question 2",
          "status": "Not Addressed",
          "evidence": "",
          "last_reviewed": null,
          "reviewed_by": null
        },
        {
          "question_id": 3,
          "short_label": "Resource Usage",
          "question": "Does the model consume excessive computational resources?",
          "handbook_ref": "Chapter 5, Question 3",
          "status": "Not Addressed",
          "evidence": "",
          "last_reviewed": null,
          "reviewed_by": null
        },
        {
          "question_id": 4,
          "short_label": "Override Controls",
          "question": "Are there controls over manual overrides?",
          "handbook_ref": "Chapter 5, Question 4",
          "status": "Not Addressed",
          "evidence": "",
          "last_reviewed": null,
          "reviewed_by": null
        },
        {
          "question_id": 5,
          "short_label": "Output Consumption",
          "question": "How is the output consumed for risk decision-making?",
          "handbook_ref": "Chapter 5, Question 5",
          "status": "Not Addressed",
          "evidence": "",
          "last_reviewed": null,
          "reviewed_by": null
        },
        {
          "question_id": 6,
          "short_label": "Model Chaining",
          "question": "Is the model's output used as input to another model?",
          "handbook_ref": "Chapter 5, Question 6",
          "status": "Not Addressed",
          "evidence": "",
          "last_reviewed": null,
          "reviewed_by": null
        },
        {
          "question_id": 7,
          "short_label": "Weaknesses",
          "question": "Does the model have weaknesses and limitations of use?",
          "handbook_ref": "Chapter 5, Question 7",
          "status": "Not Addressed",
          "evidence": "",
          "last_reviewed": null,
          "reviewed_by": null
        },
        {
          "question_id": 8,
          "short_label": "Monitoring",
          "question": "What type of monitoring is required?",
          "handbook_ref": "Chapter 5, Question 8",
          "status": "Not Addressed",
          "evidence": "",
          "last_reviewed": null,
          "reviewed_by": null
        },
        {
          "question_id": 9,
          "short_label": "Overall Risk",